{
  "coverage": [
    {
      "component_id": "ag:component:agent-eval",
      "observed_manifest_count": 1
    },
    {
      "component_id": "ag:component:agent-harness",
      "observed_manifest_count": 1
    },
    {
      "component_id": "ag:component:agent-relay",
      "observed_manifest_count": 1
    },
    {
      "component_id": "ag:component:atlas",
      "observed_manifest_count": 1
    },
    {
      "component_id": "ag:component:authorization",
      "observed_manifest_count": 1
    },
    {
      "component_id": "ag:component:brand",
      "observed_manifest_count": 1
    },
    {
      "component_id": "ag:component:business-ops",
      "observed_manifest_count": 1
    },
    {
      "component_id": "ag:component:constitution",
      "observed_manifest_count": 1
    },
    {
      "component_id": "ag:component:contracts",
      "observed_manifest_count": 1
    },
    {
      "component_id": "ag:component:definitions",
      "observed_manifest_count": 1
    },
    {
      "component_id": "ag:component:docs",
      "observed_manifest_count": 1
    },
    {
      "component_id": "ag:component:events",
      "observed_manifest_count": 1
    },
    {
      "component_id": "ag:component:goals",
      "observed_manifest_count": 1
    },
    {
      "component_id": "ag:component:heartbeat",
      "observed_manifest_count": 1
    },
    {
      "component_id": "ag:component:identity-core",
      "observed_manifest_count": 1
    },
    {
      "component_id": "ag:component:incident",
      "observed_manifest_count": 1
    },
    {
      "component_id": "ag:component:intelligence-gateway",
      "observed_manifest_count": 1
    },
    {
      "component_id": "ag:component:invariants",
      "observed_manifest_count": 1
    },
    {
      "component_id": "ag:component:job-runtime",
      "observed_manifest_count": 1
    },
    {
      "component_id": "ag:component:kernel-core",
      "observed_manifest_count": 1
    },
    {
      "component_id": "ag:component:ledger",
      "observed_manifest_count": 1
    },
    {
      "component_id": "ag:component:memory-store",
      "observed_manifest_count": 1
    },
    {
      "component_id": "ag:component:metrics",
      "observed_manifest_count": 1
    },
    {
      "component_id": "ag:component:mission-graph",
      "observed_manifest_count": 1
    },
    {
      "component_id": "ag:component:mission-inference",
      "observed_manifest_count": 1
    },
    {
      "component_id": "ag:component:mission-routing",
      "observed_manifest_count": 1
    },
    {
      "component_id": "ag:component:muse-supervisor",
      "observed_manifest_count": 1
    },
    {
      "component_id": "ag:component:observability",
      "observed_manifest_count": 1
    },
    {
      "component_id": "ag:component:orchestrator",
      "observed_manifest_count": 1
    },
    {
      "component_id": "ag:component:outcomes",
      "observed_manifest_count": 1
    },
    {
      "component_id": "ag:component:peer-protocol",
      "observed_manifest_count": 1
    },
    {
      "component_id": "ag:component:portfolio",
      "observed_manifest_count": 1
    },
    {
      "component_id": "ag:component:proactive-runtime",
      "observed_manifest_count": 1
    },
    {
      "component_id": "ag:component:promotion-gates",
      "observed_manifest_count": 1
    },
    {
      "component_id": "ag:component:relay",
      "observed_manifest_count": 0
    },
    {
      "component_id": "ag:component:rendetalje",
      "observed_manifest_count": 1
    },
    {
      "component_id": "ag:component:runtime",
      "observed_manifest_count": 1
    },
    {
      "component_id": "ag:component:runtime-host",
      "observed_manifest_count": 1
    },
    {
      "component_id": "ag:component:scheduler",
      "observed_manifest_count": 1
    },
    {
      "component_id": "ag:component:sentinel",
      "observed_manifest_count": 1
    },
    {
      "component_id": "ag:component:studio",
      "observed_manifest_count": 1
    },
    {
      "component_id": "ag:component:telemetry",
      "observed_manifest_count": 1
    },
    {
      "component_id": "ag:component:tenant-core",
      "observed_manifest_count": 1
    },
    {
      "component_id": "ag:component:triggers",
      "observed_manifest_count": 1
    },
    {
      "component_id": "ag:component:veranza",
      "observed_manifest_count": 1
    },
    {
      "component_id": "ag:component:veranza-control",
      "observed_manifest_count": 1
    },
    {
      "component_id": "ag:component:veranza-detect",
      "observed_manifest_count": 1
    },
    {
      "component_id": "ag:component:veranza-evidence",
      "observed_manifest_count": 1
    },
    {
      "component_id": "ag:component:veranza-gateway",
      "observed_manifest_count": 1
    },
    {
      "component_id": "ag:component:veranza-identity",
      "observed_manifest_count": 1
    },
    {
      "component_id": "ag:component:veranza-ledger",
      "observed_manifest_count": 1
    },
    {
      "component_id": "ag:component:veranza-runtime",
      "observed_manifest_count": 1
    },
    {
      "component_id": "ag:component:work-intelligence",
      "observed_manifest_count": 0
    },
    {
      "component_id": "ag:legacy:avc:agent-eval",
      "observed_manifest_count": 1
    },
    {
      "component_id": "ag:legacy:avc:agent-gateway",
      "observed_manifest_count": 1
    },
    {
      "component_id": "ag:legacy:avc:agent-harness",
      "observed_manifest_count": 1
    },
    {
      "component_id": "ag:legacy:avc:agent-observability",
      "observed_manifest_count": 1
    },
    {
      "component_id": "ag:legacy:avc:agent-relay",
      "observed_manifest_count": 1
    },
    {
      "component_id": "ag:legacy:avc:avc-desktop",
      "observed_manifest_count": 1
    },
    {
      "component_id": "ag:legacy:avc:avc-eval",
      "observed_manifest_count": 1
    },
    {
      "component_id": "ag:legacy:avc:avc-llm",
      "observed_manifest_count": 1
    },
    {
      "component_id": "ag:legacy:avc:cli",
      "observed_manifest_count": 1
    },
    {
      "component_id": "ag:legacy:avc:company-daemon",
      "observed_manifest_count": 1
    },
    {
      "component_id": "ag:legacy:avc:constitution",
      "observed_manifest_count": 1
    },
    {
      "component_id": "ag:legacy:avc:contracts",
      "observed_manifest_count": 1
    },
    {
      "component_id": "ag:legacy:avc:creative-assets",
      "observed_manifest_count": 1
    },
    {
      "component_id": "ag:legacy:avc:events",
      "observed_manifest_count": 1
    },
    {
      "component_id": "ag:legacy:avc:hermes-adapter",
      "observed_manifest_count": 1
    },
    {
      "component_id": "ag:legacy:avc:identity-core",
      "observed_manifest_count": 1
    },
    {
      "component_id": "ag:legacy:avc:identity-worker",
      "observed_manifest_count": 1
    },
    {
      "component_id": "ag:legacy:avc:incident",
      "observed_manifest_count": 1
    },
    {
      "component_id": "ag:legacy:avc:intelligence-gateway",
      "observed_manifest_count": 1
    },
    {
      "component_id": "ag:legacy:avc:invariant-registry",
      "observed_manifest_count": 1
    },
    {
      "component_id": "ag:legacy:avc:job-runtime",
      "observed_manifest_count": 1
    },
    {
      "component_id": "ag:legacy:avc:kernel-core",
      "observed_manifest_count": 1
    },
    {
      "component_id": "ag:legacy:avc:leadrescue",
      "observed_manifest_count": 1
    },
    {
      "component_id": "ag:legacy:avc:ledger",
      "observed_manifest_count": 1
    },
    {
      "component_id": "ag:legacy:avc:memory-store",
      "observed_manifest_count": 1
    },
    {
      "component_id": "ag:legacy:avc:mission-graph",
      "observed_manifest_count": 1
    },
    {
      "component_id": "ag:legacy:avc:mission-graph-authority",
      "observed_manifest_count": 1
    },
    {
      "component_id": "ag:legacy:avc:model-edge",
      "observed_manifest_count": 1
    },
    {
      "component_id": "ag:legacy:avc:orchestrator",
      "observed_manifest_count": 1
    },
    {
      "component_id": "ag:legacy:avc:peer-protocol",
      "observed_manifest_count": 1
    },
    {
      "component_id": "ag:legacy:avc:plugin-deepsec",
      "observed_manifest_count": 1
    },
    {
      "component_id": "ag:legacy:avc:portfolio",
      "observed_manifest_count": 1
    },
    {
      "component_id": "ag:legacy:avc:proactive-runtime",
      "observed_manifest_count": 1
    },
    {
      "component_id": "ag:legacy:avc:product-catalog",
      "observed_manifest_count": 1
    },
    {
      "component_id": "ag:legacy:avc:product-installer-adapter",
      "observed_manifest_count": 1
    },
    {
      "component_id": "ag:legacy:avc:runner-bridge",
      "observed_manifest_count": 1
    },
    {
      "component_id": "ag:legacy:avc:runtime-metrics",
      "observed_manifest_count": 1
    },
    {
      "component_id": "ag:legacy:avc:runtime-orchestrator",
      "observed_manifest_count": 1
    },
    {
      "component_id": "ag:legacy:avc:security-assurance",
      "observed_manifest_count": 1
    },
    {
      "component_id": "ag:legacy:avc:serviceops",
      "observed_manifest_count": 1
    },
    {
      "component_id": "ag:legacy:avc:serviceops-mcp",
      "observed_manifest_count": 1
    },
    {
      "component_id": "ag:legacy:avc:telemetry",
      "observed_manifest_count": 1
    },
    {
      "component_id": "ag:legacy:avc:tenant-core",
      "observed_manifest_count": 1
    },
    {
      "component_id": "ag:legacy:avc:visual-verifier",
      "observed_manifest_count": 1
    }
  ],
  "edges": [
    {
      "dependency_name": "@aftergraph/proactive-runtime",
      "epistemic_status": "OBSERVED",
      "evidence_refs": [
        "git://Aftergraph/runtime@45d1d95282ca0cb6926c49ce43847884e2eaae43/packages/agent-eval/package.json"
      ],
      "source_component_id": "ag:component:agent-eval",